{
  "$schema": "https://json-schema.org/draft/2020-12/schema",
  "title": "Smith Metadata Studio native task",
  "type": "object",
  "additionalProperties": false,
  "required": ["schema_version", "name", "description", "steps"],
  "properties": {
    "schema_version": {"const": 1},
    "name": {
      "type": "string",
      "pattern": "^[a-z0-9]+(?:-[a-z0-9]+)*$",
      "maxLength": 128
    },
    "description": {"type": "string", "maxLength": 4096},
    "steps": {
      "type": "array",
      "minItems": 1,
      "items": {
        "oneOf": [
          {"$ref": "#/$defs/delete_tag"},
          {"$ref": "#/$defs/build_field"},
          {"$ref": "#/$defs/sort_fields"}
        ]
      }
    }
  },
  "$defs": {
    "step_id": {
      "type": "string",
      "pattern": "^[a-z0-9]+(?:-[a-z0-9]+)*$",
      "maxLength": 128
    },
    "source": {
      "type": "object",
      "additionalProperties": false,
      "required": ["format", "line", "instruction_sha256"],
      "properties": {
        "format": {"const": "marcedit-task"},
        "line": {"type": "integer", "minimum": 1},
        "instruction_sha256": {
          "type": "string",
          "pattern": "^[0-9a-f]{64}$"
        }
      }
    },
    "delete_tag": {
      "type": "object",
      "additionalProperties": false,
      "required": ["id", "action", "target"],
      "properties": {
        "id": {"$ref": "#/$defs/step_id"},
        "action": {"const": "delete_tag"},
        "target": {
          "type": "object",
          "additionalProperties": false,
          "required": ["tag"],
          "properties": {
            "tag": {"type": "string", "pattern": "^[0-9X]{3}$"}
          }
        },
        "source": {"$ref": "#/$defs/source"}
      }
    },
    "text_segment": {
      "type": "object",
      "additionalProperties": false,
      "required": ["type", "value"],
      "properties": {
        "type": {"const": "text"},
        "value": {"type": "string", "maxLength": 4096}
      }
    },
    "control_field_segment": {
      "type": "object",
      "additionalProperties": false,
      "required": ["type", "tag"],
      "properties": {
        "type": {"const": "control_field"},
        "tag": {"type": "string", "pattern": "^[0-9]{3}$"}
      }
    },
    "subfield": {
      "type": "object",
      "additionalProperties": false,
      "required": ["code", "segments"],
      "properties": {
        "code": {"type": "string", "pattern": "^[0-9a-z]$"},
        "segments": {
          "type": "array",
          "minItems": 1,
          "items": {
            "oneOf": [
              {"$ref": "#/$defs/text_segment"},
              {"$ref": "#/$defs/control_field_segment"}
            ]
          }
        }
      }
    },
    "build_field": {
      "type": "object",
      "additionalProperties": false,
      "required": [
        "id",
        "action",
        "target",
        "subfields",
        "missing_source",
        "existing_target"
      ],
      "properties": {
        "id": {"$ref": "#/$defs/step_id"},
        "action": {"const": "build_field"},
        "target": {
          "type": "object",
          "additionalProperties": false,
          "required": ["tag", "indicators"],
          "properties": {
            "tag": {"type": "string", "pattern": "^[0-9]{3}$"},
            "indicators": {
              "type": "array",
              "minItems": 2,
              "maxItems": 2,
              "prefixItems": [
                {"type": "string", "minLength": 1, "maxLength": 1},
                {"type": "string", "minLength": 1, "maxLength": 1}
              ],
              "items": false
            }
          }
        },
        "subfields": {
          "type": "array",
          "minItems": 1,
          "items": {"$ref": "#/$defs/subfield"}
        },
        "missing_source": {"const": "skip_and_report"},
        "existing_target": {"enum": ["append", "skip"]},
        "source": {"$ref": "#/$defs/source"}
      }
    },
    "sort_fields": {
      "type": "object",
      "additionalProperties": false,
      "required": ["id", "action"],
      "properties": {
        "id": {"$ref": "#/$defs/step_id"},
        "action": {"const": "sort_fields"},
        "source": {"$ref": "#/$defs/source"}
      }
    }
  }
}
